,Nos ambitions,"2S2I Solutions & Services, SSII spécialisée en informatique de production et développements logiciels, affiche une double ambition :

1. Offrir le meilleur de la technologie à ses clients tout en préservant respect et convivialité pour ses collaborateurs. 

2. Accompagner ses clients en réalisant des prestations conduites par des équipes expertes composées de : 
- un pôle support technique, composé de consultants experts, en support des ingénieurs intervenant dans le cadre de nos prestations.
- des ingénieurs d'affaires, interlocuteurs privilégiés du client, qui ont pour mission de piloter le déroulement des prestations.
- un Responsable Technique, véritable manager d'équipe, qui assure l'encadrement des ingénieurs, veille au maintien et à l'évolution de leurs compétences technologiques et participe activement à leur évolution professionnelle.
- un Responsable de formation, qui suit le besoin en formation de chaque intervenant et lui donne accès aux modules de formation qui peuvent s'avérer nécessaires au bon déroulement de son évolution professionnelle.
- un Pôle RH composé de spécialistes des Ressources Humaines, qui assure le suivi du bon déroulement de carrière de chaque ingénieur 2S2I Solutions & Services

Crée par des Cadres de SSII, 2S2I Solutions & Services est une société généralistes  de services informatiques qui offre ses services en mode Régie ou Projet auprès des Grands Comptes Nationaux et des PME/PMI Régionales. Implantés sur l'ensemble des pôles d'attractions de l'industrie Informatique, nous appuyons notre savoir faire sur une offre adaptée, souple et basée sur la réactivité de nos équipes afin de se positionner comme votre partenaire sur une relation durable.

VISITEZ NOTRE SITE : http://www.2s2isolutions.com

Pour consulter nos offres d'emploi : 
http://www.2s2isolutions.com/recrutement.php?page=offres

Pour déposer une candidature spontanée : 
http://www.2s2isolutions.com/recrutement.php?page=spon",,,http://www.2s2isolutions.com,,,,2007,0,1735,43.6172040,3.9154207,120,Rue de Thor,Port Marianne,Montpellier,montpellier,34006,Occitanie,occitanie,Hérault,herault,France,FR,"120 rue de thor, 34000, montpellier, france",2008-07-03 16:08:19,php
,SOCIETE,"Open ID permet aux entreprises d'accroître la performance de leurs systèmes d'informations par des prestations d'Accompagnement et de Conseil. Nous innovons par notre démarche adaptée aux profils et aux problématiques métiers de chacun de nos clients en apportant une offre complète comprenant prestations intellectuelles et solutions  

Open ID en quelques mots 
   
Création : 2006 
Offre : Conseil, Prestation de Service, Solutions Logicielles 
Implantation : Paris, Aix en Provence, Montpellier, Arras, Rennes/quimper 
Clients : Dassault Aviation, Dassault Systèmes, ERDF, Sanofi, Crédit Agricole, Centres Hospitaliers, Conseils Généraux, ... 

Le conseil 
L'informatique a longtemps été considérée comme un support à la stratégie de l'entreprise. Aujourd'hui, nous devons la considérer comme partie intégrante de cette stratégie. Dès lors, il convient de s'assurer que la stratégie du système d'information est alignée sur la stratégie de l'entreprise. Cela passe par la mise en place d'un cadre de Gouvernance du SI. La Gouvernance IT est une pratique managériale dont l'objectif est d'assurer que l'informatique répond bel et bien aux objectifs suivants : 
- Alignement avec les objectifs de l'entreprise ; 
- Permettre à l'entreprise d'exploiter les opportunités en maximisant ses bénéfices ; 
- Optimiser l'utilisation des ressources informatiques ; 
- Gérer les risques de manière adéquate. 

Solutions innovantes 
Les solutions que nous préconisons sont le reflet de notre volonté d'améliorer les performances de votre système d'information sans disperser votre budget informatique  : 
- Solution de Virtualisation Applicative 
- Solution de virtualisation des postes de travail 
- Solution de publication d'applications en client léger 
- Solution de gestion des serveurs applicatifs 

Services orientés performance 
L'offre de service d'Open ID s'articule en priorité autour des domaines suivants : 

- Intégration systèmes : Planifier, déployer, optimiser et gérer vos infrastructures complexes ; 
- AMOA, AMOE et Management de Projets ; 
- Formation sur mesure : vous permettre d'acquérir et d'optimiser vos compétences IT. 
  
L'informatique a ceci de particulier qu'il est possible de faire développer une application aussi facilement que le permet l'imagination. Toute la difficulté consiste à identifier correctement les besoins, indépendamment de toute solution technique et de choisir un fournisseur pour le réaliser. 


Nous poursuivons notre croissance et renforçons notre positionnement autour des technologies de virtualisation d'application et de poste de travail : pour accompagner cette évolution, nous sommes à la recherche de spécialistes des métiers Infrastructure, Systèmes, stockage et poste de travail : des profils orientés virtualisation avec VMware, Citrix, SAN : baie EMC, Dell, ou HP et autour des technologies Microsoft.

Vous souhaitez être acteur de votre carrière, dans une structure  humaine qui privilégie l'échange, nous vous invitons à consulter notre site www.openid.fr ou m'envoyer votre cv actualisé à : recrut-idf@openid.fr pour Paris ou recrut-sud@openid.fr pour la région Languedoc Roussillon et Paca",,,http://www.openid.fr/,,,,2006,0,1889,48.8971375,2.2858067,119,Rue du Président Wilson,,Levallois-Perret,levallois-perret,92300,Île-de-France,ile-de-france,Hauts-de-Seine,hauts-de-seine,France,FR,"119 rue du président wilson, 92300, levallois perret, france",2008-07-22 10:15:02,php
,POPFAX,"Popfax.com est le Leader Européen de solutions de Fax Professionnelles.
Nous maîtrisons en interne tous les éléments clef de notre business:
- plateforme technique et développements.
- infrastructure Télécom et IT
- Ventes d'offres sur mesure
- APIs d'intégration
- Web marketing
- Service Client - CRM maison
- Chaine de paiement et facturation
100% des ingénieurs qui ont travaillé pour nous ont progressé dans leur vision technique et leur compréhension des offres SaaS.",2 M€,,http://www.popfax.com,,,,2006,0,1961,48.9174698,2.2004810,3,Passage des Bleuets,,Carrières-sur-Seine,carrieres-sur-seine,78420,Île-de-France,ile-de-france,Yvelines,yvelines,France,FR,"3, passage des bleuets, 78420, carrieres sur seine, france",2005-11-02 11:29:11,php
1,CELANEO,"Créé en 2008, Celaneo est une agence web et un cabinet de conseil doté d’une forte spécialisation dans les technologies web et mobile.

Basés à Paris, nous avons emménagé dans de nouveaux locaux au 9, rue des Halles dans le 1er.

Nous intervenons dans toutes les phases des projets, du conseil à la réalisation. Nous offrons des prestations au forfait, en régie ou en régie forfaitée. Nos clients sont essentiellement des grands comptes mais nous travaillons aussi avec des petites et moyennes entreprises. Nous adaptons notre approche et notre méthodologie à votre dimension.

Notre offre

Celaneo dispose d’une expertise technique à haute valeur ajoutée associée à de solides compétences métier. Nicolas Rolland, fondateur et directeur de l’entreprise, a forgé son expérience de consultant informatique, ingénieur d’études et de développement chez France Telecom notamment.

Notre équipe, en croissance permanente, est composée de quatorze collaborateurs aux compétences complémentaires (ingénieurs techniques, référenceurs, consultants AMOA, webmarketers…).

Nous sommes attentifs à la complémentarité des profils afin de proposer des prestations globales.",,less_than_20_employees,http://www.celaneo.com,,,,2008,0,2002,48.8595615,2.3467388,9,Rue des Halles,Paris 1er Arrondissement,Paris,paris,75001,Île-de-France,ile-de-france,,,France,FR,"9 rue des halles, 75001, paris, france",2008-08-10 11:32:10,php
,WEB ET SOLUTIONS,"Basée à Rouen, Web et Solutions est une Agence Web spécialisée dans la création de sites Internet haut de gamme et un éditeur de solutions mobiles pour tout type d'entreprises, administrations et associations. Notre agence excelle parallèlement dans le développement de solutions métiers sur mesure dans les domaines de l'Internet, l'Extranet, l'Intranet, la mobilité ou encore la cartographie.",,,http://www.webetsolutions.com,,,,2003,0,2043,49.3975460,1.0290263,,Rue de la Voute,,Rouen,rouen,76650,Normandie,normandie,Seine-Maritime,seine-maritime,France,FR,"za la voute, 76650, petit couronne, france",2008-08-22 07:38:07,php
,la Société,"Pointcube est une entreprise spécialisée dans la réalité virtuelle et propose des solutions graphiques pour l'industrie, les services et le e-commerce.
Un savoir-faire unique qui a su allier deux technologies de pointe : la 3D ultra-réaliste issue de l'industrie cinématographique et les technologies 3D temps réel venant de l'industrie du jeu vidéo.

Pointcube propose à ses clients une mise en situation réelle et interactive de leurs produits, projets et articles commerciaux.
répondant aux attentes les plus exigeantes en termes de qualité, de prix et de délais de production.

Pointcube c'est aussi une équipe jeune, enthousiaste et dynamique.",,,,,,,,0,2045,45.7558576,4.8627216,77,Rue Maurice Flandin,La Villette,Lyon,lyon,69003,Auvergne-Rhône-Alpes,auvergne-rhone-alpes,Métropole de Lyon,metropole-de-lyon,France,FR,"77 rue maurice flandin, 69003, lyon, france",2008-08-22 12:46:01,php
,CONCRETIO,"Concretio capitalise une expérience de plus de 15 ans dans les technologies de l'information et du marché de l'emploi IT en Europe.
Concretio met à votre service une équipe d'experts en ingénierie salariale et fiscale pour un seul objectif : votre accompagnement professionnel.
C'est parce que vous avez besoin d'un service de qualité, de transparence et d'une maitrise parfaite de l'environnement règlementaire que Concretio saura vous préconiser des solutions de portage sur mesure.
Nous vous aidons à réussir dans le portage salarial et à évoluer vers l'entreprenariat.",,,http://www.concretio-services.com,,,,2008,0,2099,49.0091265,2.2848525,14,Rue de Paris,,Sarcelles,sarcelles,95680,Île-de-France,ile-de-france,Val-d'Oise,val-d-oise,France,FR,"14 rue de paris, 95680, montlignon, france",2008-09-03 12:41:30,php
10,MyTechTrip,"MyTechTrip met à disposition des acteurs du transport public les outils informatiques permettant d’assurer la qualité et la cohérence de l’information diffusée aux voyageurs sur l’ensemble du système d’informations et des supports de diffusion.

Aujourd’hui spécialiste du secteur du Transport, nous proposons des solutions innovantes pour répondre aux problématiques spécifiques liées à la mobilité et à la gestion de l’Information Voyageurs.

Notre ambition est de devenir à court terme le leader mondial dans le domaine de l'information voyageurs.",,employees_20_99,http://www.mytechtrip.com,,,,2012,0,2123,43.2690386,5.3887851,21,Avenue de Mazargues,8e Arrondissement,Marseille,marseille,13008,Provence-Alpes-Côte d'Azur,provence-alpes-cote-d-azur,Bouches-du-Rhône,bouches-du-rhone,France,FR,"21 avenue de mazargues, 13008, marseille, france",2005-11-09 14:01:54,php
,Poste de consultant EDI à pourvoir immédiatement,"OLANE Consulting est société de conseil informatique en pleine croissance, spécialisée dans les Echanges Electroniques Professionnels (EEP). Nous intervenons sur des missions de conseil, cadrage et mise en oeuvre de solutions d'échanges électroniques professionnels, pour le compte de clients grands comptes, dans les secteurs de la distribution, l'agro alimentaire, l'industrie ou la finance.
Notre siège social est situé à Paris, La Défense.

Mission
Dans le cadre de notre développement, nous recherchons un CONSULTANT EDI, spécialisé en intégration SAP. Au sein des équipes de nos clients, vous :

- coordonnez les échanges avec les partenaires pour la définition et la mise en pratique des flux EDI.
- mettez en application les standards EDIFACT
- rédigez les spécifications de profils de messages / mappings et suivez leur  mise en oeuvre
- maîtrisez les fonctions des modules SAP SD et MM
- analysez et développez les interfaces au moyen d'IDOCS et BAPI et de programmes ABAP
- paramétrez SAP pour mise en oeuvre d'EDI / IDOCS

Le poste est à pourvoir immédiatement.

Profil
De formation BAC 2 minimum, vous possédez une expérience de 3 à 5 ans dans la mise en pratique des flux EDI, en environnement SAP. 

Vous justifiez d'une première expérience réussie dans la pratique d'un traducteur EDI et dans le développement d'interfaces (IDOCS/BAPI), avec les modules SD/MM. 

Connaissance des secteurs de la grande distribution ou de l'automobile appréciée.

Votre niveau d'anglais vous permet de dialoguer quotidiennement, par oral et par écrit, avec vos interlocuteurs, dans un contexte international.

Vous êtes mobile, sur la région parisienne et sur la France (possibilité de missions en régions)


Merci de communiquer votre CV, lettre de motivation et prétentions salariales, à contact@olaneo.fr",,,,,,,2005,0,2175,48.8951704,2.2432344,,Rue Ségoffin,Quartier Gambetta,Courbevoie,courbevoie,92400,Île-de-France,ile-de-france,Hauts-de-Seine,hauts-de-seine,France,FR,"immeuble, 92036, courbevoie, france",2008-09-13 15:06:57,php
,ITY CONSULTING,"ITY Consulting est un cabinet de conseil spécialisé en performance et transformation des systèmes d'information.

L'objectif d'ITY Consulting est de vous accompagner afin de RATIONNALISER et SECURISER l'évolution de votre système d'information.

A ce titre ITY Consulting intervient auprès de ses clients sur différents axes :

- Performance de SI :
. Audit de situation,
. Schéma directeur & Urbanisation,
. Processus Internes & Externes,
. Performance Economique.
- Transformation du SI :
. Conduite du Changement,
. Pilotage de Projets,
. Management de Transition,
. Assistance MOA/MOE.
Notre objectif est de sécuriser, rationaliser et participer à l'évolution de votre ""système d'information"" afin que vous restiez concentré sur votre coeur de métier. 

A ce titre nous intervenons par exemple au sein de sociétés telles que des mutuelles, des assureurs, des banques, des éditeurs de logiciels, des industriels, etc.

Nous sommes à votre disposition pour vous décrire notre approche au regard de vos attentes et répondre à toutes vos questions.

www.ity-consulting.com",,,http://www.ity-consulting.com,,,,2007,0,2255,45.7932380,4.7759018,42,Chemin du Moulin Carron,,Écully,ecully,69130,Auvergne-Rhône-Alpes,auvergne-rhone-alpes,Métropole de Lyon,metropole-de-lyon,France,FR,"42 chemin du moulin carron, 69130, ecully, france",2008-09-26 03:31:50,php
,SSII d'avant-garde,"Xpress2people est une SSII à taille humaine spécialisée dans les services informatiques à forte valeur ajoutée.
Nous développons une relation de conseil personnalisée et durable en toute indépendance.
Pôles d'expertise : Sécurité - Systèmes et réseaux -sgbd.
Labo : création de produits de sécurité.

Une implantation au Canada : X2P CANADA.

Un état d'esprit différent du marché : centré sur la qualité, la satisfaction client et la qualité des rapports humains.",,,http://www.xpress2people.com,,,,2006,0,2294,48.8695299,2.3591713,8,Rue Taylor,Paris 10e Arrondissement,Paris,paris,75010,Île-de-France,ile-de-france,,,France,FR,"8 rue taylor, 75010, paris, france",2008-10-02 09:17:40,php
,Progressive,Cabinet de recrutement spécialisé IT et Finances pour les freelances,,,http://www.progressive-fr.com,,,,1990,0,2417,48.8725965,2.3358001,,Boulevard Haussmann,Paris 9e Arrondissement,Paris,paris,75009,Île-de-France,ile-de-france,,,France,FR,"10 bd haussmann, 75009, paris, france",2005-11-28 15:15:46,php
,Cabinet de recrutement Aequatio,"AEQUATIO est un cabinet de recrutement spécialisé dans les métiers de l'Informatique.
Notre philosophie: apporter une satisfaction égale à tous, tant pour nos candidats que pour nos clients (rapport gagnant %u2013 gagnant).
AEQUATIO a fait ses preuves et travaille aujourd'hui avec les plus grands, nos profils informatiques vont du secteur bancaire à celui du bâtiment.
Nous avons des opportunités en CDI France entière et à l'étranger",,,,,,,,1,2506,48.7990560,2.4786236,32,Rue Garibaldi,Adamville,Saint-Maur-des-Fossés,saint-maur-des-fosses,94100,Île-de-France,ile-de-france,Val-de-Marne,val-de-marne,France,FR,"32 rue garibaldi, 94100, st maur, france",2008-10-27 13:34:54,php
,Quelques informations sur Ai3,"Ai3 est une société de service en ingénierie informatique (SSII) spécialisée dans l'intégration de solutions innovantes reposant les technologies Microsoft.

Fondée par deux consultants et un architecte, Ai3 se veut différente des SSII ""classiques"".

Partenaire certifiée de Microsoft, Ai3 apporte toute son expertise et son savoir-faire aux entreprises désireuse d'employer des solutions innovantes répondant en tout point à leurs besoins et à leurs contraintes, tout en préservant une approche résolument orginale : l'Usage.",,,http://www.ai3.fr,,,,2008,1,2512,48.8310681,2.3765997,118,Avenue de France,Paris 13e Arrondissement,Paris,paris,75013,Île-de-France,ile-de-france,,,France,FR,"118 avenue de france, 75013, paris, france",2008-10-27 15:21:25,php
9,ITSGROUP,"ITS Group est une ESN, spécialisée dans le développement durable des infrastructures IT. Le groupe propose une offre complète de Gestion des infrastructures à forte valeur ajoutée : Transformation, Maintien en Condition Opérationnelle sur site ou hors site et  Hébergement des SI, Conseil & Assistance à maîtrise d’ouvrage. ITS Group mène une politique dynamique de partenariat avec les éditeurs majeurs du marché (CA, Orsyp, SYSTAR, Microsoft,  Oracle, Symantec, VMware, Veeam, Arkeia,  Netapp, EMC, CISCO, DELL, Falconstor, DataCore), dans un souci constant de garantir, aux utilisateurs, un haut niveau de disponibilité, de sécurité et d’accessibilité à leurs systèmes d’information.",,more_than_1000_employees,http://www.itsgroup.com,,,,1997,1,2536,48.8373804,2.2301961,42,Rue de Bellevue,Parchamp - Albert Kahn,Boulogne-Billancourt,boulogne-billancourt,92100,Île-de-France,ile-de-france,Hauts-de-Seine,hauts-de-seine,France,FR,"42 rue de bellevue, 92100, boulogne-billancourt, france",2005-12-05 13:20:30,php
,spherius,"Société de Services et de Formation.

Spécialisé sur l'administration des systèmes d'exploitation Unix, Linux et Windows.",,,http://www.spherius.fr,,,,2003,1,2542,48.8698145,2.3835582,5,Allée Georges Rouault,Quartier de Belleville,Paris,paris,75020,Île-de-France,ile-de-france,,,France,FR,"5 allee georges rouault, 75020, paris, france",2005-12-05 17:08:36,php
9,OBJECTWARE MANAGEMENT GROUP,"Crée en 1999, Objectware est une société de conseil et d’ingénierie informatique spécialisée dans le secteur de la banque, de la finance de marché, et de l’assurance, dont la notoriété sur les grands comptes de la place de Paris a fait un spécialiste reconnu des décideurs en Maîtrise d’ouvrage comme en Maîtrise d’œuvre. 

Notre activité couvre la totalité du cycle de vie des systèmes d'informations (Pilotage et Gestion de projet, Conseil en MOA, Conception, Réalisation, Maintenance, Production Exploitation).",,employees_250_999,https://www.objectware.fr,,,,1999,1,2593,48.8618572,2.3405241,,Rue Saint-Honoré,Paris 1er Arrondissement,Paris,paris,75001,Île-de-France,ile-de-france,,,France,FR,"191 rue saint honoré, 75001, paris, france",2005-12-08 10:21:30,php
,"CVO-CyberConseil, partenaire des Industries de la Santé","CVO-CyberConseil, PME de 230 collaborateurs (dont 200 consultants), est une société de conseil crée en 1995, 100% dédiée à l'Industrie de la Santé. Nos clients sont les industries pharmaceutiques, Chimie fine, laboratoires, dispositifs médicaux, ingénierie/équipementiers et également les cosmétiques.

Nous avons 3 domaines d'expertise qui sont : la Validation, la Qualification, l'Ingénierie

Validation:
- V systèmes informatisés
- V systèmes informatisés de laboratoires
- V systèmes automatisés, aussi bien sur la partie automate que sur la supervision de production
- Qualification des équipements et utilités aussi bien en production (autoclave, mélangeur, comprimeuse..) que des équipements de conditionnement (blistèreuses, encartonneuse%u2026, des équipements de laboratoire (type HPLC avec Agilent, Variant%u2026), des utilités (HVAC, eau purifiée, réseau d'azote%u2026)
- Validation de procédés.

Qualification et la Veille Réglementaire(ou Affaires réglementaires).

Ingénierie :
Notre positionnement est de faire de l'Assistance à Maitrise d'Ouvrage. Nous intervenons à différents niveaux : recueil des besoins utilisateurs, rédaction du Cahier des Charges, lancement des appels d'offres, sélection des fournisseurs et suivi du projet jusqu'à la mise en service.

Par rapport aux types de prestations que nous sommes amenés à faire chez nos clients :
- Conseil
- Audit
- Assistance technique
- Formations: Centre de Formation agrée: à double vocation. Tout d'abord répondre aux besoins de nos clients et former nos propres collaborateurs.
- Management de projet

En terme d'agences :
Agence France: Lyon (siège), Lille, Paris, Strasbourg, Toulouse, Val de Reuil
Agence Belgique
Agence Suisse
Agence USA

Nous sommes en permanence à la recherche de nouveaux collaborateurs. Contactez nous !

Appellez moi au 06 87 72 81 24 pour le Sud Ouest. Merci
	
Secteur :  Conseils et Services",,,http://www.cyberconseil.com,,,,1995,1,2630,43.6338822,1.3780621,,Rue Marcel Doret,,Blagnac,blagnac,31700,Occitanie,occitanie,Haute-Garonne,haute-garonne,France,FR,"2 ter rue marcel doret, 31700, blagnac, france",2008-11-03 14:42:24,php
9,FREE EXPERT,"FREE EXPERT est une SSII  dont le cœur de métier est le recrutement et la délégation d'experts informaticiens pour des missions de MOA, MOE, NTIC et BI. Fort d’un réseau de 5 000 consultants, nous intervenons également pour des missions d’expertise, de conception et de réalisation de proof of concept.
Les décideurs de Grands Comptes et de PME – PMI nous font confiance pour les aider à trouver rapidement leurs Experts Informaticiens, ils nous sollicitent en tant que DRH externalisée depuis près de 12 ans.",,employees_20_99,http://www.free-expert.com,,,,2000,0,2721,48.8730422,2.2300748,22,Rue Edouard Nieuport,Quartier Écluse-Belvédère,Suresnes,suresnes,92150,Île-de-France,ile-de-france,Hauts-de-Seine,hauts-de-seine,France,FR,"22 rue edouard nieuport, 92150, suresnes, france",2005-12-15 18:29:31,php
,Recrutemenent développeur PHP,"Le groupe Mediactive, créé en 1995, a pour vocation de:

- Concevoir et développer des sites internet et extranet à fortes valeurs ajoutées.

- Administrer 3 salles blanches d'hébergement de serveurs sous Linux et Windows.

- Assurer l'infogérance de parcs informatiques pour diverses structures.

- Jouer un rôle clés dans la mise en %u0153uvre de systèmes de gestion pour d'importantes opérations évènementielles.


Quelques réalisations :

http://www.ravel2008.fr : le site d'orientation des bacheliers pour leur inscription post bac (6 M de pages vues, 1 M de visiteurs).

http://www.v-trafic.com (géo localisation).

http://www.bellavista-villas.com : location en ligne de demeures de charme.

http://grips.proinno-europe.eu : L'extranet et le site public du projet Grips pour la Commission Européenne.

http://www.3ds.com/news-events/acforum/overview : le site dédié au European Catia Forum 2008 réunissant à Eurodisney les experts du logiciel phare de la 3D.

D'autres sites à accès réservé :

http://www.orange-exchange.com (accès restreint) : site de travail collaboratif des agences qui gère le budget publicitaire d'Orange dans le monde.

Le site de travail collaboratif de l'Afii - Ministère de l'2conomie et des Finances (Agence Française pour les Investissements Internationaux).

http://www.simark-exchange.net : le site de veille concurrentielle de la maison mère et des filiales d'Hachette Collections (8 pays).",,,,,,,1995,0,2950,48.8749826,2.3491707,3,Cité Paradis,Paris 10e Arrondissement,Paris,paris,75010,Île-de-France,ile-de-france,,,France,FR,"3 cité paradis, 75010, paris, france",2008-11-20 10:07:19,php
9,INGENIANCE,"Spécialiste en Conseil et en Ingénierie des Systèmes d'information, notre entreprise vous accompagne dans une dynamique 'start up', forte d'une équipe expérimentée au service de ses clients. Notre succès est avant tout celui de nos équipes et de nos partenaires. Nous faisons appel aux compétences et au savoir-faire reconnus de chacun pour satisfaire au mieux toutes les attentes. Avec l'ambition de la réussite, nous attachons un soin particulier tant au confort de nos consultants qu'à l'écoute de nos clients.",,employees_20_99,http://www.noemiconseil.fr,,,,,0,2967,,,,,,,,,,,,,,,"paris la défense grande arche, 92044, paris, france",2006-01-04 17:18:13,php
,Portage salarial,Société de portage salarial,,,http://www.portage-plus.com,,,,2000,0,2999,48.8338492,2.3247034,149,Avenue du Maine,Paris,Paris,paris,75014,Île-de-France,ile-de-france,,,France,FR,"149, avenue du maine, 75014, paris, france",2006-01-06 08:46:03,php
